{
  "$schema": "http://json-schema.org/draft-07/schema#",
  "$id": "nlboot-evidence.v1",
  "title": "NLBootEvidence",
  "description": "Schema for NLBoot evidence records (version 1).",
  "type": "object",
  "required": ["schemaVersion", "kind", "timestamp", "target", "boot", "status", "signature"],
  "additionalProperties": false,
  "properties": {
    "schemaVersion": {
      "type": "string",
      "const": "nlboot-evidence.v1",
      "description": "Schema version identifier."
    },
    "kind": {
      "type": "string",
      "const": "NLBootEvidence",
      "description": "Record kind discriminator."
    },
    "timestamp": {
      "type": "string",
      "description": "ISO 8601 timestamp of the evidence record.",
      "pattern": "^\\d{4}-\\d{2}-\\d{2}T\\d{2}:\\d{2}:\\d{2}Z$"
    },
    "target": {
      "type": "object",
      "description": "Boot target description.",
      "required": ["host", "arch"],
      "additionalProperties": false,
      "properties": {
        "host": {
          "type": "string",
          "description": "Hostname of the boot target."
        },
        "arch": {
          "type": "string",
          "description": "CPU architecture (e.g. x86_64, aarch64)."
        },
        "uefi": {
          "type": "boolean",
          "description": "Whether the target uses UEFI boot."
        }
      }
    },
    "boot": {
      "type": "object",
      "description": "Boot configuration details.",
      "required": ["loader", "kernel"],
      "additionalProperties": false,
      "properties": {
        "loader": {
          "type": "string",
          "description": "Boot loader used (e.g. systemd-boot, grub)."
        },
        "kernel": {
          "type": "string",
          "description": "Kernel version string."
        },
        "cmdline": {
          "type": "string",
          "description": "Kernel command line arguments."
        }
      }
    },
    "status": {
      "type": "string",
      "description": "Verification status of the boot evidence.",
      "enum": ["verified", "failed", "unknown"]
    },
    "signature": {
      "type": "string",
      "description": "Evidence signature (stub; not cryptographically verified in this tool)."
    }
  }
}
